<?xml version="1.0" encoding="SHIFT_JIS" standalone="no"?>
<!DOCTYPE sanac PUBLIC "sanac" "sanac.dtd">
<sanac frame="CADLIVE" frameInfo="2.14">
<model name="HSP13_0421" modelInfo="heat shock response model13">
<panel size="1600" magnification="100"/>
<listOfCompartments numberOfCompartments="2">
<compartment name="environment" volume="" R="255" G="255" B="255">
<subCompartment id="1" cat="Square" cx="-100" cy="-100" l="-1" h="80" w="80"/>
</compartment>
<compartment name="cytoplasm" volume="" R="224" G="224" B="255">
<subCompartment id="2" cat="Circle" cx="804" cy="772" l="708" h="-4" w="1416"/>
</compartment>
</listOfCompartments>
<listOfSpecies numberOfSpecies="29">
<Specie specieID="1" name="s70" compartment="cytoplasm">
<specieAttribute specieClass="protein" massBalance="on" totalAmount="constant" decomposition="off" initialAmount="" isVisible="true"/>
</Specie>
<Specie specieID="2" name="RNAP" compartment="cytoplasm">
<specieAttribute specieClass="protein" massBalance="on" totalAmount="constant" decomposition="off" initialAmount="" isVisible="true"/>
</Specie>
<Specie specieID="3" name="s32" compartment="cytoplasm">
<specieAttribute specieClass="protein" massBalance="on" totalAmount="variable" decomposition="on" initialAmount="" isVisible="true"/>
</Specie>
<Specie specieID="4" name="FtsH" compartment="cytoplasm">
<specieAttribute specieClass="protein" massBalance="on" totalAmount="variable" decomposition="on" initialAmount="" isVisible="true"/>
</Specie>
<Specie specieID="5" name="DnaK" compartment="cytoplasm">
<specieAttribute specieClass="protein" massBalance="on" totalAmount="variable" decomposition="on" initialAmount="" isVisible="true"/>
</Specie>
<Specie specieID="6" name="Protein" compartment="cytoplasm">
<specieAttribute specieClass="protein" massBalance="on" totalAmount="variable" decomposition="on" initialAmount="" isVisible="true"/>
</Specie>
<Specie specieID="7" name="Protein-f" compartment="cytoplasm">
<specieAttribute specieClass="protein" massBalance="on" totalAmount="variable" decomposition="on" initialAmount="" isVisible="true"/>
</Specie>
<Specie specieID="8" name="Enhancer(s32)" compartment="cytoplasm">
<specieAttribute specieClass="DNA_enhancer" massBalance="on" totalAmount="constant" decomposition="off" initialAmount="" isVisible="true"/>
</Specie>
<Specie specieID="9" name="Enhancer(HSP)" compartment="cytoplasm">
<specieAttribute specieClass="DNA_enhancer" massBalance="on" totalAmount="constant" decomposition="off" initialAmount="" isVisible="true"/>
</Specie>
<Specie specieID="10" name="D" compartment="cytoplasm">
<specieAttribute specieClass="DNA_others" massBalance="off" totalAmount="constant" decomposition="off" initialAmount="" isVisible="true"/>
</Specie>
<Specie specieID="11" name="mRNA(s32)" compartment="cytoplasm">
<specieAttribute specieClass="RNA" massBalance="off" totalAmount="variable" decomposition="on" initialAmount="" isVisible="true"/>
</Specie>
<Specie specieID="12" name="mRNA(DnaK)" compartment="cytoplasm">
<specieAttribute specieClass="RNA" massBalance="off" totalAmount="variable" decomposition="on" initialAmount="" isVisible="true"/>
</Specie>
<Specie specieID="13" name="mRNA(FtsH)" compartment="cytoplasm">
<specieAttribute specieClass="RNA" massBalance="off" totalAmount="variable" decomposition="on" initialAmount="" isVisible="true"/>
</Specie>
<Specie specieID="14" name="mRNA(Protein)" compartment="cytoplasm">
<specieAttribute specieClass="RNA" massBalance="off" totalAmount="variable" decomposition="on" initialAmount="" isVisible="true"/>
</Specie>
<Specie specieID="15" name="Gene(s32)" compartment="cytoplasm">
<specieAttribute specieClass="DNA_gene" massBalance="off" totalAmount="constant" decomposition="off" initialAmount="" isVisible="true"/>
</Specie>
<Specie specieID="16" name="Gene(DnaK)" compartment="cytoplasm">
<specieAttribute specieClass="DNA_gene" massBalance="off" totalAmount="constant" decomposition="off" initialAmount="" isVisible="true"/>
</Specie>
<Specie specieID="17" name="Gene(FtsH)" compartment="cytoplasm">
<specieAttribute specieClass="DNA_gene" massBalance="off" totalAmount="constant" decomposition="off" initialAmount="" isVisible="true"/>
</Specie>
<Specie specieID="18" name="Gene(Protein)" compartment="cytoplasm">
<specieAttribute specieClass="DNA_gene" massBalance="off" totalAmount="constant" decomposition="off" initialAmount="" isVisible="true"/>
</Specie>
<Specie specieID="20" name="s70:RNAP" compartment="cytoplasm">
<specieAttribute specieClass="complex" massBalance="off" totalAmount="variable" decomposition="on" initialAmount="" isVisible="true"/>
<listOfElements numberOfElements="2">
<specieReference specieID="1" name="s70" compartment="cytoplasm" stoichiometry="1" cx="633" cy="481"/>
<specieReference specieID="2" name="RNAP" compartment="cytoplasm" stoichiometry="1" cx="633" cy="616"/>
</listOfElements>
</Specie>
<Specie specieID="22" name="Enhancer(s32):s70:RNAP" compartment="cytoplasm">
<specieAttribute specieClass="complex" massBalance="off" totalAmount="variable" decomposition="on" initialAmount="" isVisible="true"/>
<listOfElements numberOfElements="2">
<specieReference specieID="8" name="Enhancer(s32)" compartment="cytoplasm" stoichiometry="1" cx="687" cy="442"/>
<specieReference specieID="20" name="s70:RNAP" compartment="cytoplasm" stoichiometry="1" cx="633" cy="546"/>
</listOfElements>
</Specie>
<Specie specieID="23" name="RNAP:s32" compartment="cytoplasm">
<specieAttribute specieClass="complex" massBalance="off" totalAmount="variable" decomposition="on" initialAmount="" isVisible="true"/>
<listOfElements numberOfElements="2">
<specieReference specieID="2" name="RNAP" compartment="cytoplasm" stoichiometry="1" cx="633" cy="616"/>
<specieReference specieID="3" name="s32" compartment="cytoplasm" stoichiometry="1" cx="886" cy="616"/>
</listOfElements>
</Specie>
<Specie specieID="24" name="Enhancer(HSP):RNAP:s32" compartment="cytoplasm">
<specieAttribute specieClass="complex" massBalance="off" totalAmount="variable" decomposition="on" initialAmount="" isVisible="true"/>
<listOfElements numberOfElements="2">
<specieReference specieID="9" name="Enhancer(HSP)" compartment="cytoplasm" stoichiometry="1" cx="756" cy="753"/>
<specieReference specieID="23" name="RNAP:s32" compartment="cytoplasm" stoichiometry="1" cx="757" cy="616"/>
</listOfElements>
</Specie>
<Specie specieID="25" name="s32:DnaK" compartment="cytoplasm">
<specieAttribute specieClass="complex" massBalance="off" totalAmount="variable" decomposition="on" initialAmount="" isVisible="true"/>
<listOfElements numberOfElements="2">
<specieReference specieID="3" name="s32" compartment="cytoplasm" stoichiometry="1" cx="886" cy="616"/>
<specieReference specieID="5" name="DnaK" compartment="cytoplasm" stoichiometry="1" cx="1080" cy="794"/>
</listOfElements>
</Specie>
<Specie specieID="28" name="s32:FtsH" compartment="cytoplasm">
<specieAttribute specieClass="modifier_complex" massBalance="on" totalAmount="variable" decomposition="on" initialAmount="" isVisible="false"/>
<listOfElements numberOfElements="2">
<specieReference specieID="3" name="s32" compartment="cytoplasm" stoichiometry="1" cx="886" cy="616"/>
<specieReference specieID="4" name="FtsH" compartment="cytoplasm" stoichiometry="1" cx="1036" cy="724"/>
</listOfElements>
</Specie>
<Specie specieID="29" name="Protein:DnaK" compartment="cytoplasm">
<specieAttribute specieClass="modifier_complex" massBalance="on" totalAmount="variable" decomposition="on" initialAmount="" isVisible="false"/>
<listOfElements numberOfElements="2">
<specieReference specieID="6" name="Protein" compartment="cytoplasm" stoichiometry="1" cx="1209" cy="543"/>
<specieReference specieID="5" name="DnaK" compartment="cytoplasm" stoichiometry="1" cx="1080" cy="794"/>
</listOfElements>
</Specie>
<Specie specieID="30" name="D:s70:RNAP" compartment="cytoplasm">
<specieAttribute specieClass="complex" massBalance="off" totalAmount="variable" decomposition="on" initialAmount="" isVisible="true"/>
<listOfElements numberOfElements="2">
<specieReference specieID="10" name="D" compartment="cytoplasm" stoichiometry="1" cx="592" cy="749"/>
<specieReference specieID="20" name="s70:RNAP" compartment="cytoplasm" stoichiometry="1" cx="633" cy="546"/>
</listOfElements>
</Specie>
<Specie specieID="31" name="D:RNAP:s32" compartment="cytoplasm">
<specieAttribute specieClass="complex" massBalance="off" totalAmount="variable" decomposition="on" initialAmount="" isVisible="true"/>
<listOfElements numberOfElements="2">
<specieReference specieID="10" name="D" compartment="cytoplasm" stoichiometry="1" cx="592" cy="749"/>
<specieReference specieID="23" name="RNAP:s32" compartment="cytoplasm" stoichiometry="1" cx="757" cy="616"/>
</listOfElements>
</Specie>
<Specie specieID="32" name="RNAP:D" compartment="cytoplasm">
<specieAttribute specieClass="complex" massBalance="off" totalAmount="variable" decomposition="on" initialAmount="" isVisible="true"/>
<listOfElements numberOfElements="2">
<specieReference specieID="2" name="RNAP" compartment="cytoplasm" stoichiometry="1" cx="633" cy="616"/>
<specieReference specieID="10" name="D" compartment="cytoplasm" stoichiometry="1" cx="592" cy="749"/>
</listOfElements>
</Specie>
<Specie specieID="34" name="s32:DnaK:FtsH" compartment="cytoplasm">
<specieAttribute specieClass="modifier_complex" massBalance="on" totalAmount="variable" decomposition="on" initialAmount="" isVisible="false"/>
<listOfElements numberOfElements="2">
<specieReference specieID="25" name="s32:DnaK" compartment="cytoplasm" stoichiometry="1" cx="1080" cy="616"/>
<specieReference specieID="4" name="FtsH" compartment="cytoplasm" stoichiometry="1" cx="1036" cy="724"/>
</listOfElements>
</Specie>
</listOfSpecies>
<listOfReactions layer="gene" numberOfReactions="8">
<Reaction reactionID="10" groupID="4" reactionType="transcription" isConvertible="true" reactionName="#10" isVisible="true" modifierReactionEquation="Enhancer(s32):s70:RNAP -&gt;&gt; Gene(s32) -&gt; mRNA(s32)">